{
  "cycle": 5,
  "grade": 8,
  "status": "in_progress",
  "lastUpdated": "2025-12-09",
  "topic": "Waves & Information Transfer",
  "completion": {
    "overall": 50,
    "curriculumDesign": 100,
    "rubrics": 0,
    "week1": { "forms": 100, "lessonPlan": 100, "studentPage": 100, "slides": 0 },
    "week2": { "forms": 100, "lessonPlan": 100, "studentPage": 0, "slides": 0 },
    "week3": { "forms": 0, "lessonPlan": 100, "studentPage": 0, "slides": 0 }
  },
  "deployed": {
    "week1": false,
    "week2": false,
    "week3": false
  },
  "notes": "Week 1 complete (forms.gs, student-page.html). Week 2 forms.gs complete, student-page pending. Week 3 and rubrics pending."
}
