{
  "cycle": 7,
  "grade": 8,
  "status": "complete",
  "lastUpdated": "2025-12-12",
  "topic": "Chemical Reactions & Conservation",
  "completion": {
    "overall": 95,
    "curriculumDesign": 100,
    "rubrics": 100,
    "week1": { "forms": 100, "lessonPlan": 100, "studentPage": 100, "slides": 0 },
    "week2": { "forms": 100, "lessonPlan": 100, "studentPage": 100, "slides": 0 },
    "week3": { "forms": 100, "lessonPlan": 100, "studentPage": 100, "slides": 0 },
    "week4": { "forms": 100, "lessonPlan": 100, "studentPage": 100, "slides": 0 }
  },
  "deployed": {
    "week1": false,
    "week2": false,
    "week3": false,
    "week4": false
  },
  "notes": "All curriculum content complete: W1-W4 have forms.gs, lesson plans, student pages, and rubrics. W1: Evidence of Chemical Reactions (Fading Glow Mystery). W2: Reaction Types & Conservation (Disappearing Solid Mystery). W3: Reaction Rates & Factors (Cooking Speed Mystery). W4: Synthesis & Assessment. Only slides remaining."
}
