{
  "cycle": 4,
  "grade": 8,
  "status": "complete",
  "lastUpdated": "2025-12-08",
  "topic": "Ecosystems & Energy Transfer",
  "completion": {
    "overall": 100,
    "curriculumDesign": 100,
    "rubrics": 100,
    "week1": { "forms": 100, "lessonPlan": 100, "studentPage": 100, "slides": 100 },
    "week2": { "forms": 100, "lessonPlan": 100, "studentPage": 100, "slides": 100 },
    "week3": { "forms": 100, "lessonPlan": 100, "studentPage": 100, "slides": 100 }
  },
  "deployed": {
    "week1": false,
    "week2": false,
    "week3": false
  },
  "notes": "All content complete including slides. Forms: W1=991, W2=982, W3=482 lines. Ready for deployment pending form URL integration."
}
