{
  "cycle": 6,
  "grade": 8,
  "status": "in_progress",
  "lastUpdated": "2025-12-10",
  "topic": "Electricity & Magnetism",
  "completion": {
    "overall": 55,
    "curriculumDesign": 100,
    "rubrics": 0,
    "week1": { "forms": 100, "lessonPlan": 100, "studentPage": 0, "slides": 0 },
    "week2": { "forms": 0, "lessonPlan": 100, "studentPage": 0, "slides": 0 },
    "week3": { "forms": 0, "lessonPlan": 100, "studentPage": 0, "slides": 0 }
  },
  "deployed": {
    "week1": false,
    "week2": false,
    "week3": false
  },
  "notes": "Curriculum design, lesson plans, and W1 forms complete. W2-W3 forms and all student pages pending."
}
