{
  "cycle": 3,
  "grade": 8,
  "status": "complete",
  "lastUpdated": "2025-12-05",
  "topic": "Natural Selection & Forces",
  "completion": {
    "overall": 100,
    "curriculumDesign": 100,
    "rubrics": 100,
    "week1": { "forms": 100, "lessonPlan": 100, "studentPage": 100, "slides": 100 },
    "week2": { "forms": 100, "lessonPlan": 100, "studentPage": 100, "slides": 100 },
    "week3": { "forms": 100, "lessonPlan": 100, "studentPage": 100, "slides": 100 }
  },
  "deployed": {
    "week1": true,
    "week2": true,
    "week3": true
  },
  "notes": "Fully developed and deployed. First complete cycle."
}
