{
  "$comment": "PRODUCTION CONTENT - See 'readonly' flags below for protected weeks",
  "cycle": 3,
  "grade": 7,
  "status": "complete",
  "lastUpdated": "2025-12-07",
  "topic": "Climate Change & Energy Flow",
  "completion": {
    "overall": 100,
    "curriculumDesign": 100,
    "rubrics": 100,
    "week1": { "forms": 100, "lessonPlan": 100, "studentPage": 100, "slides": 100 },
    "week2": { "forms": 100, "lessonPlan": 100, "studentPage": 100, "slides": 100 },
    "week3": { "forms": 100, "lessonPlan": 100, "studentPage": 100, "slides": 100 }
  },
  "deployed": {
    "week1": true,
    "week2": true,
    "week3": true
  },
  "readonly": {
    "week2": true,
    "week2_reason": "PRODUCTION - DO NOT EDIT. Deployed December 2025. Serves as legacy documentation."
  },
  "notes": "Fully developed and deployed. First complete cycle. Week 2 is now read-only production content."
}
