{
  "cycle": 4,
  "grade": 7,
  "status": "in_progress",
  "lastUpdated": "2025-12-08",
  "topic": "Biogeochemical Cycles & Human Impact",
  "completion": {
    "overall": 95,
    "curriculumDesign": 100,
    "rubrics": 100,
    "week1": { "forms": 100, "lessonPlan": 100, "studentPage": 100, "slides": 0 },
    "week2": { "forms": 100, "lessonPlan": 100, "studentPage": 100, "slides": 0 },
    "week3": { "forms": 100, "lessonPlan": 100, "studentPage": 100, "slides": 0 }
  },
  "deployed": {
    "week1": false,
    "week2": false,
    "week3": false
  },
  "notes": "All content complete. Only slides (0%) not created. Forms: W1=979, W2=662, W3=463 lines. Ready for deployment pending form URL integration."
}
